{
  "$schema": "https://json-schema.org/draft/2020-12/schema",
  "$id": "https://chson.dev/api/schema.json",
  "title": "ChSON Document",
  "description": "A structured format for software cheatsheets based on cognitive science principles of retrieval and chunking.",
  "type": "object",
  "additionalProperties": true,
  "required": ["title", "publicationDate", "description", "sections"],
  "properties": {
    "$schema": {
      "type": "string",
      "description": "JSON Schema reference URL."
    },
    "title": {
      "type": "string",
      "minLength": 1,
      "maxLength": 80,
      "description": "The name of this document (max 80 chars for readability)."
    },
    "version": {
      "type": "string",
      "minLength": 1,
      "description": "Version of the subject matter this document covers."
    },
    "publicationDate": {
      "type": "string",
      "anyOf": [
        { "format": "date" },
        { "format": "date-time" }
      ],
      "description": "When this document was published or last updated."
    },
    "description": {
      "type": "string",
      "minLength": 1,
      "maxLength": 150,
      "description": "A brief summary of what this document covers (max 150 chars)."
    },
    "author": {
      "type": "string",
      "description": "The author or maintainer of this document."
    },
    "license": {
      "type": "string",
      "description": "License identifier for this document (e.g., 'MIT', 'CC-BY-4.0')."
    },
    "homepage": {
      "type": "string",
      "format": "uri",
      "description": "URL of the official website or documentation for the subject matter."
    },
    "icon": {
      "type": "string",
      "description": "URL or relative path to an image representing this document (logo, icon, etc.)."
    },
    "tags": {
      "type": "array",
      "items": { "type": "string" },
      "description": "Keywords for categorization and discovery."
    },
    "retrievalDirection": {
      "type": "string",
      "enum": ["intent-to-mechanism", "mechanism-to-meaning"],
      "description": "Optional hint for renderers about the cognitive lookup direction. 'intent-to-mechanism': user knows what they want to do, needs the command/shortcut. 'mechanism-to-meaning': user sees a command/syntax, needs to understand what it does."
    },
    "anchorLabel": {
      "type": "string",
      "maxLength": 50,
      "description": "Display name for the anchor column (default: 'Anchor', max 50 chars). Use 'Example' for code samples, 'Shortcut' for keyboard shortcuts, etc."
    },
    "contentLabel": {
      "type": "string",
      "maxLength": 50,
      "description": "Display name for the content column (default: 'Content', max 50 chars). Use 'Description' for explanations, 'Action' for intent-based lookups, etc."
    },
    "formatHints": {
      "type": "object",
      "additionalProperties": false,
      "description": "Optional rendering hints for how to format anchor and content fields. When not specified, format is inferred from retrievalDirection: mechanism columns use 'code' format, intent columns use 'text' format. Markdown format supports inline code (`code`), bold (**text**), italics (*text*), and links ([text](url)).",
      "properties": {
        "anchor": {
          "type": "string",
          "enum": ["text", "markdown", "code"],
          "description": "Format hint for the anchor column. 'text': plain text. 'markdown': inline markdown (code, bold, italics, links). 'code': monospace code block."
        },
        "content": {
          "type": "string",
          "enum": ["text", "markdown", "code"],
          "description": "Format hint for the content column. 'text': plain text. 'markdown': inline markdown (code, bold, italics, links). 'code': monospace code block."
        }
      }
    },
    "metadata": {
      "type": "object",
      "additionalProperties": true,
      "description": "Additional freeform metadata (category, source, etc.)."
    },
    "sections": {
      "type": "array",
      "minItems": 1,
      "items": { "$ref": "#/$defs/section" },
      "description": "Logical groupings of related entries (chunks)."
    }
  },
  "$defs": {
    "section": {
      "type": "object",
      "additionalProperties": true,
      "required": ["title", "entries"],
      "properties": {
        "title": {
          "type": "string",
          "minLength": 1,
          "maxLength": 100,
          "description": "The name of this section (max 100 chars for scannability)."
        },
        "description": {
          "type": "string",
          "description": "Optional explanation of what this section covers."
        },
        "entries": {
          "type": "array",
          "minItems": 1,
          "items": { "$ref": "#/$defs/entry" },
          "description": "The anchor-content pairs in this section."
        }
      }
    },
    "entry": {
      "type": "object",
      "additionalProperties": true,
      "required": ["anchor", "content"],
      "properties": {
        "anchor": {
          "type": "string",
          "minLength": 1,
          "maxLength": 100,
          "description": "The retrieval anchor: what users scan for (max 100 chars). Typically a command, shortcut, or action name."
        },
        "content": {
          "type": "string",
          "minLength": 1,
          "maxLength": 150,
          "description": "The associated content: what users need to know once they find the anchor (max 150 chars)."
        },
        "details": {
          "type": "string",
          "description": "Extended explanation beyond the brief content (no length limit; progressive disclosure). Always markdown (GitHub-Flavored Markdown in @chson/ui)."
        },
        "url": {
          "type": "string",
          "format": "uri",
          "description": "Reference link to learn more about this entry."
        }
      }
    }
  }
}
