{
  "$schema": "https://chson.dev/api/schema.json",
  "title": "Git Essentials",
  "version": "2.x",
  "publicationDate": "2026-01-16",
  "description": "Essential git commands for day-to-day development.",
  "homepage": "https://git-scm.com/",
  "tags": ["cli", "version-control"],
  "retrievalDirection": "mechanism-to-meaning",
  "anchorLabel": "Example",
  "contentLabel": "Description",
  "sections": [
    {
      "title": "Setup",
      "entries": [
        {
          "anchor": "git config --global user.name \"Your Name\"",
          "content": "Configure your name for commits (also set user.email)."
        },
        {
          "anchor": "git config --global init.defaultBranch main",
          "content": "Use 'main' as the default branch for new repos."
        }
      ]
    },
    {
      "title": "Inspect",
      "entries": [
        {
          "anchor": "git status",
          "content": "Show staged, unstaged, and untracked files."
        },
        {
          "anchor": "git log --oneline --graph -10",
          "content": "View recent commit history in compact format."
        },
        {
          "anchor": "git diff --staged",
          "content": "Show changes staged for the next commit."
        },
        {
          "anchor": "git blame <file>",
          "content": "Show who last modified each line of a file."
        }
      ]
    },
    {
      "title": "Stage & Commit",
      "entries": [
        {
          "anchor": "git add .",
          "content": "Stage all changes in current directory."
        },
        {
          "anchor": "git add -p",
          "content": "Stage changes hunk by hunk."
        },
        {
          "anchor": "git restore --staged <file>",
          "content": "Remove file from staging area, keep changes."
        },
        {
          "anchor": "git commit -m \"<message>\"",
          "content": "Create a commit with staged changes."
        },
        {
          "anchor": "git commit --amend",
          "content": "Modify the last commit (message or content)."
        }
      ]
    },
    {
      "title": "Branches",
      "entries": [
        {
          "anchor": "git switch -c <branch>",
          "content": "Create a new branch and switch to it."
        },
        {
          "anchor": "git switch <branch>",
          "content": "Switch to an existing branch."
        },
        {
          "anchor": "git branch -vv",
          "content": "List branches with upstream tracking info."
        },
        {
          "anchor": "git branch -d <branch>",
          "content": "Delete a merged branch (-D to force)."
        }
      ]
    },
    {
      "title": "Remote",
      "entries": [
        {
          "anchor": "git clone <url>",
          "content": "Download a repository and its history."
        },
        {
          "anchor": "git fetch --prune",
          "content": "Download refs and clean up deleted remote branches."
        },
        {
          "anchor": "git pull --rebase",
          "content": "Fetch and rebase local commits on top."
        },
        {
          "anchor": "git push -u origin <branch>",
          "content": "Push branch and set upstream tracking."
        }
      ]
    },
    {
      "title": "Merge & Rebase",
      "entries": [
        {
          "anchor": "git merge <branch>",
          "content": "Merge another branch into current branch."
        },
        {
          "anchor": "git rebase <base>",
          "content": "Replay commits on top of another base."
        },
        {
          "anchor": "git rebase --continue",
          "content": "Continue after resolving conflicts."
        },
        {
          "anchor": "git cherry-pick <commit>",
          "content": "Apply a specific commit to current branch."
        }
      ]
    },
    {
      "title": "Stash",
      "entries": [
        {
          "anchor": "git stash push -m \"<message>\"",
          "content": "Temporarily save uncommitted changes."
        },
        {
          "anchor": "git stash list",
          "content": "Show all stashed changes."
        },
        {
          "anchor": "git stash pop",
          "content": "Restore and remove most recent stash."
        }
      ]
    },
    {
      "title": "Undo",
      "entries": [
        {
          "anchor": "git restore <file>",
          "content": "Discard working tree changes to a file."
        },
        {
          "anchor": "git revert HEAD",
          "content": "Create a new commit that undoes a previous one."
        },
        {
          "anchor": "git reset --soft HEAD~1",
          "content": "Undo last commit, keep changes staged."
        },
        {
          "anchor": "git reflog",
          "content": "Show history of HEAD movements for recovery."
        }
      ]
    }
  ]
}
