{
  "$schema": "https://chson.dev/schema/v2/chson.schema.json",
  "title": "Vim Essentials",
  "version": "9.x",
  "publicationDate": "2026-01-16",
  "description": "Essential Vim commands for text editing.",
  "retrievalDirection": "mechanism-to-meaning",
  "anchorLabel": "Example",
  "contentLabel": "Description",
  "metadata": {
    "homepage": "https://www.vim.org/",
    "category": "editor"
  },
  "sections": [
    {
      "title": "Modes",
      "entries": [
        {
          "anchor": "Esc",
          "content": "Return to normal mode from any other mode."
        },
        {
          "anchor": "i",
          "content": "Enter insert mode before cursor."
        },
        {
          "anchor": "a",
          "content": "Enter insert mode after cursor."
        },
        {
          "anchor": "v",
          "content": "Start character-wise visual selection."
        },
        {
          "anchor": "V",
          "content": "Start line-wise visual selection."
        },
        {
          "anchor": ":",
          "content": "Enter command-line mode."
        }
      ]
    },
    {
      "title": "Navigation",
      "entries": [
        {
          "anchor": "h j k l",
          "content": "Left, down, up, right."
        },
        {
          "anchor": "w",
          "content": "Jump to start of next word."
        },
        {
          "anchor": "b",
          "content": "Jump to start of previous word."
        },
        {
          "anchor": "0",
          "content": "Jump to beginning of line."
        },
        {
          "anchor": "$",
          "content": "Jump to end of line."
        },
        {
          "anchor": "gg",
          "content": "Jump to first line of file."
        },
        {
          "anchor": "G",
          "content": "Jump to last line of file."
        },
        {
          "anchor": "<n>G",
          "content": "Jump to line n."
        }
      ]
    },
    {
      "title": "Editing",
      "entries": [
        {
          "anchor": "x",
          "content": "Delete character under cursor."
        },
        {
          "anchor": "dw",
          "content": "Delete from cursor to start of next word."
        },
        {
          "anchor": "dd",
          "content": "Delete entire current line."
        },
        {
          "anchor": "cw",
          "content": "Delete word and enter insert mode."
        },
        {
          "anchor": "cc",
          "content": "Delete line and enter insert mode."
        },
        {
          "anchor": "r",
          "content": "Replace single character under cursor."
        },
        {
          "anchor": "u",
          "content": "Undo last change."
        },
        {
          "anchor": "Ctrl+r",
          "content": "Redo last undone change."
        }
      ]
    },
    {
      "title": "Copy & Paste",
      "entries": [
        {
          "anchor": "yy",
          "content": "Copy current line."
        },
        {
          "anchor": "yw",
          "content": "Copy from cursor to start of next word."
        },
        {
          "anchor": "p",
          "content": "Paste after cursor."
        },
        {
          "anchor": "P",
          "content": "Paste before cursor."
        }
      ]
    },
    {
      "title": "Search",
      "entries": [
        {
          "anchor": "/<pattern>",
          "content": "Search for pattern forward."
        },
        {
          "anchor": "?<pattern>",
          "content": "Search for pattern backward."
        },
        {
          "anchor": "n",
          "content": "Jump to next search match."
        },
        {
          "anchor": "N",
          "content": "Jump to previous search match."
        },
        {
          "anchor": ":%s/<old>/<new>/g",
          "content": "Replace all occurrences in file."
        }
      ]
    },
    {
      "title": "Files",
      "entries": [
        {
          "anchor": ":w",
          "content": "Write current file to disk."
        },
        {
          "anchor": ":q",
          "content": "Quit (fails if unsaved changes)."
        },
        {
          "anchor": ":wq",
          "content": "Write and quit."
        },
        {
          "anchor": ":q!",
          "content": "Quit without saving changes."
        },
        {
          "anchor": ":e <file>",
          "content": "Open another file for editing."
        }
      ]
    }
  ]
}
